"Title";"Acronym";"Rank";"PrimaryFoR"
"IEEE International Performance Computing and Communications Conference";"IPCCC";"C";"4606"
"IEEE International Symposium on a World of Wireless, Mobile and Multimedia Networks";"WoWMoM";"C";"4606"
"IEEE International Symposium on Cluster, Cloud and Grid Computing";"CCGRID";"B";"4606"
"IEEE International Symposium on Network Computing and Applications";"NCA";"B";"4606"
"IEEE International Symposium on Parallel and Distributed Processing with Applications";"ISPA";"C";"4606"
"IEEE International Symposium on Personal and Indoor Mobile Radio Conference";"PIMRC";"B";"4606"
"IEEE International Symposium on Real-Time Distributed Computing";"ISORC";"C";"4606"
"IEEE International Workshop on Quality of Service";"IWQoS";"B";"4606"
"IEEE LAN/MAN Workshop";"LANMAN";"C";"4606"
"IEEE Network Operations and Management Symposium";"NOMS";"B";"4606"
"IEEE Real-Time and Embedded Technology and Applications Symposium";"RTAS";"A";"4606"
"IEEE Symposium on Computers and Communications";"ISCC";"C";"4606"
"IEEE Symposium on Field Programmable Custom Computing Machines";"FCCM";"National/Regional";"CSE"
"IEEE Symposium on High-Performance Interconnects";"HOTI";"National: USA";"4606"
"IEEE Vehicular Technology Conference";"VTC";"B";"4606"
"IEEE Wireless Communications and Networking Conference";"WCNC";"B";"4606"
"IEEE Workshop on High Performance Switching and Routing";"HPSR";"C";"4606"
"IEEE/ACM International Conference on Computer-Aided Design";"ICCAD";"A";"CSE"
"IEEE/IFIP International Conference on Dependable Systems and Networks";"DSN";"A";"4606"
"IEEE/IFIP International Conference on Embedded and Ubiquitous Computing";"EUC";"C";"4606"
"IFAC Conference on System Structure and Control";"SSSC";"C";"4612"
"IFIP International Conference on Distributed Applications and Interoperable Systems";"DAIS";"C";"4606"
"IFIP International Conference on Network and Parallel Computing";"NPC";"C";"4606"
"IFIP International Conference on Networking";"Networking";"B";"4606"
"IFIP Working Conferences on Virtual Enterprises";"PRO-VE";"C";"4606"
"IFIP/IEEE International Conference on Performance Evaluation and Modeling in Wired and Wireless Networks";"PEMWN";"C";"4606"
"IFIP/IEEE International Symposium on Integrated Management (even years sharing with NOMS)";"IM";"B";"4606"
"Intelligent Distributed Computing";"IDC";"Unranked";"4606"
"International Conference and Exhibition on High Performance Computing in the Asia-Pacific Region";"HPC Asia";"C";"4606"
"International Conference for High Performance Computing, Networking, Storage and Analysis (was Supercomputing Conference)";"SC";"A";"CSE"
"International Conference on Advanced and Trusted Computing (was International Conference on Autonomic and Trusted Computing)";"ATC";"C";"4604"
"International Conference on Advanced Computing and Communications";"AdCom";"National: India";"4606"
"International Conference on Advanced Information Networking and Applications (was ICOIN)";"AINA";"B";"4606"
"International Conference on Advances in Mobile Computing and Multimedia";"MOMM";"C";"4606"
"International Conference on Algorithms and Architectures for Parallel Processing";"ICA3PP";"C";"4606"
"International Conference on Broadband Communications, Networks and Systems";"Broadnets";"C";"4606"
"International Conference on Cloud Computing and Services Science";"CLOSER";"C";"4606"
"International Conference on Cloud Engineering";"IC2E";"B";"4606"
"International Conference on Collaborative Computing: Networks, Applications and Worksharing";"CollaborateCom";"C";"4606"
"International Conference on COMmunication Systems & NETworkS";"COMSNETS";"National:India";"4606"
"International Conference on Communication Systems and Applications";"ICCSA";"C";"4606"
"International Conference on Compiler Construction";"CC";"B";"4606"
"International Conference on Compilers, Architecture, and Synthesis for Embedded Systems";"CASES";"Journal published";"4606"
"International Conference on Complex, Intelligent and Software Intensive Systems";"CISIS";"C";"4606"
"International Conference on Complexity, Future Information Systems and Risk";"COMPLEXIS";"C";"4613"
"International Conference on Computational Collective Intelligence";"ICCCI";"B";"4602"
"International Conference on Computer Communication and Networks";"ICCCN";"B";"4606"
"International Conference on Concurrency Theory";"CONCUR";"B";"4613"
"International Conference on Coordination Models and Languages";"Coordination";"C";"4606"
"International Conference on Dependability of Computer Systems";"DEPCoS";"National: Poland";"4606"
"International Conference on Distributed Computing and Artificial Intelligence";"DCAI";"National(Spain)";"4602"
"International Conference on Distributed Computing and Internet Technologies";"ICDCIT";"National: India";"4606"
"International Conference on Distributed Computing and Networking";"ICDCN";"National: India";"4606"
"International Conference on Distributed Computing Systems";"ICDCS";"A";"4606"
"International Conference on Embedded and Real Time Computing Systems and Applications";"RTCSA";"B";"4606"
"International Conference on Embedded Software";"EMSOFT";"Journal Published";"4606"
"International Conference on Embedded Wireless Systems and Networks (wasEuropean Conference on Wireless Sensor Networks)";"EWSN";"B";"4606"
"International Conference on Emerging Ubiquitous Systems and Pervasive Networks";"EUSPN";"Unranked";"4606"
"International Conference on Factory Communication Systems";"WFCS";"C";"CSE"
"International Conference on Green, Pervasive and Cloud Computing (was Grid and Pervasive Computing)";"GPC";"C";"4606"
"International Conference on Hardware/Software Codesign and System Synthesis (previously ISSN, changed in 2003)";"CODES+ISSS";"Journal Published";"CSE"
"International Conference on Heterogeneous Networking for Quality, Reliability, Security and Robustness (was International Conference on Quality of Service in Heterogeneous Wired/Wireless Networks)";"Qshine";"C";"4606"
"International Conference on High Performance Computing";"HiPC";"National: India";"4606"
"International Conference on High Performance Scientific Computing";"HPSC";"National: Vietnam";"4606"
"International Conference on Indoor Positioning and Indoor Navigation";"IPIN";"C";"4606"
"International Conference on Internet and Web Applications and Services";"ICIW";"C";"4606"
"International Conference on Internet Computing in Science and Engineering";"ICICSE";"C";"4606"
"International Conference on Management of Digital EcoSystems";"MEDES";"C";"4606"
"International Conference on Mobile and Ubiquitous Systems: Networks and Services";"Mobiquitous";"C";"4606"
"International Conference on Mobile Data Management";"MDM";"B";"4605"
"International Conference on Mobile Systems and Pervasive Computing";"MobiSPC";"Unranked";"4606"
"International Conference on Mobile Ubiquitous Computing, Systems, Services and Technologies";"UBICOMM";"C";"4606"
"International Conference on Model-Driven Engineering and Software Development";"MODELSWARD";"C";"4606"
"International Conference on Network and Service Management (amalgamation of DSOM and related workshops from 2010)";"CNSM";"B";"4606"
"International Conference on Network Protocols";"ICNP";"B";"4606"
"International Conference on Network Softwarization";"NetSoft";"B";"4606"
"International Conference on Parallel and Distributed Computing, Applications and Technologies";"PDCAT";"C";"4606"
"International Conference on Parallel and Distributed Processing Techniques and Applications";"PDPTA";"National: USA";"4606"
"International Conference on Parallel and Distributed Systems";"ICPADS";"B";"4606"
"International Conference on Parallel Architecture and Compilation Techniques";"PACT";"B";"4606"
"International Conference on Parallel Processing";"ICPP";"B";"4606"
"International Conference on Parallel Processing and Applied Mathematics";"PPAM";"National: Poland";"4606"
"International Conference on Principles of Distributed Systems";"OPODIS";"B";"4606"
"International Conference on Real-Time and Network Systems";"RTNS";"National: France";"4606"
"International Conference on Service Oriented Computing";"ICSOC";"A";"4606"
"International Conference on Simulation and Modeling Methodologies, Technologies and Applications";"SIMULTECH";"C";"4606"
"International Conference on Software Engineering, Artificial Intelligence, Networking and Parallel/Distributed Computing";"SNPD";"C";"4612"
"International Conference on Sustainable Energy Information Technology";"SEIT";"Unranked";"4601"
"International Conference on the Application and Theory of Petri Nets and Concurrency";"Petri Nets";"B";"4606"
"International Conference on Ubiquitous Intelligence and Computing";"UIC";"C";"4606"
"International Conference on Vehicle Technology and Intelligent Transport Systems";"VEHITS";"C";"4606"
"International Conference on Virtual Execution Environments";"VEE";"B";"4606"
"International Conference on VLSI Design";"VLSID";"National: India";"4606"
"International Conference on Web Information Systems Engineering";"WISE";"B";"4605"
"International Conference on Wireless Networks and Mobile Communications";"WINCOM";"C";"4606"
"International European Conference on Parallel and Distributed Computing (was International Conference on Parallel Processing)";"EuroPar";"B";"4606"
"International Network Optimization Conference";"INOC";"C";"4606"
"International Symposium on Algorithms and Experiments for  Wireless Networks";"Algosensors";"C";"4606"
"International Symposium on Autonomous Decentralized Systems";"ISADS";"C";"4606"
"International Symposium on Computer Architecture and High Performance Computing";"SBAC-PAD";"C";"4606"
"International Symposium on Distributed Computing (was WDAG)";"DISC";"A";"4606"
"International Symposium on Distributed Simulation and Real Time Applications";"DS-RT";"C";"4606"
"International Symposium on Grids and Clouds (was International Symposium on Grid Computing)";"ISGC";"C";"4606"
"International Symposium on High Performance Computer Architecture";"HPCA";"A*";"CSE"
"International Symposium on Memory Management";"ISMM";"C";"4606"
"International Symposium on Modelling and Optimization in Mobile, Ad Hoc, and Wireless Networks";"WiOpt";"B";"4606"
"International Symposium on Networks, Computers and Communications";"ISNCC";"C";"4606"
"International Symposium on Parallel and Distributed Computing";"ISPDC";"C";"4606"
"International Symposium on the Mathematical Theory of Networks and Systems";"MTNS";"C";"4606"
"International Telecommunication Networks and Applications Conference (was Australian Telecommunication Networks and Applications Conference)";"ITNAC";"Australasian C";"4606"
"International Teletraffic Congress";"ITC";"Unranked";"4606"
"International workshop on High-Level Parallel Programming and Applications";"HLPP";"C";"4606"
"International Workshop on High-Level Parallel Programming Models and Supportive Environments";"HIPS";"C";"4606"
"International Workshop on Principles of Diagnosis";"DX";"C";"4612"
"International Workshop on Software and Compilers for Embedded Systems";"SCOPES";"C";"4606"
"International Workshops on Enabling Technologies: Infrastructures for Collaborative Enterprises";"WETICE";"C";"4606"
"International World Wide Web Conference";"WWW";"A*";"4606"
"Internet Measurement Conference";"IMC";"A";"4606"
"ISC High Performance (was International Supercomputing Conference)";"ISC";"National/Regional";"4606"
"Malaysia International Conference on Communications";"MICC";"Regional";"4606"
"Network and Operating System Support for Digital Audio and Video";"NOSSDAV";"B";"4606"
"Pacific Rim International Symposium on Dependable Computing";"PRDC";"C";"4612"
"Passive and Active Measurement Conference";"PAM";"B";"4606"
"Principles and Practice of Parallel Programming";"PPoPP";"B";"4606"
"Real Time Systems Symposium";"RTSS";"A";"4606"
"Symposium Model Analysis and Simulation of Computer and Telecommunications Systems";"MASCOTS";"B";"4606"
"Symposium on High Performance Chips";"HOTCHIPS (HCS)";"C";"4606"
"Symposium on Networked Systems, Design and Implementation";"NSDI";"National: USA";"4606"
"Symposium on Parallelism in Algorithms and Architectures";"SPAA";"B";"4606"
"Symposium on Reliable Distributed Systems";"SRDS";"B";"4606"
"Testbeds and Research Infrastructures for the Development of Networks and Communities";"TridentCom";"National: China";"4606"
"The ACM International System and Storage Conference";"SYSTOR";"National:Israel";"4606"
"The ACM SIGCAS/SIGCHI Conference on Computing and Sustainable Societies";"COMPASS";"C";"4608"
"The International Conference on Future Networks and Communications";"FNC";"Unranked";"4606"
"The International Conference on Verification and Evaluation of Computer and Communication Systems";"VECoS";"C";"4606"
"Usenix Annual Technical Conference";"USENIX";"A";"4606"
"Usenix Symposium on Operating Systems Design and Implementation";"OSDI";"A*";"4606"
"USENIX Workshop on Hot Topics in Operating Systems";"HotOS";"A";"4606"
"Utility and Cloud Computing";"UCC";"Unranked";"4606"
"Workshop on Applications of Graph Theory in Wireless Ad hoc Networks and Sensor Networks";"Graph-hoc";"C";"4606"
"Workshop on Job Scheduling Strategies for Parallel Processing";"JSSPP";"C";"4606"
"Workshop on Mobile Computing Systems and Applications";"HOTMOBILE";"National: USA";"4606"
"Workshop on Programming Languages and Operating Systems";"PLOS";"C";"4606"
"ACM International Conference on Advances in Computer Entertainment (merged with DIMEA, Digital Interactive Media in Entertainment and Arts, in 2009)";"ACE";"C";"4607"
"ACM International Conference on Interactive Media Experiences";"IMX";"C";"4608"
"ACM Multimedia Systems Conference";"MMSys";"A";"4606"
"ACM SIG International Conference on Computer Graphics and Interactive Techniques";"SIGGRAPH";"A*";"4607"
"ACM SIGGRAPH conference on Motion Interaction and Games";"MIG";"C";"4607"
"ACM SIGGRAPH/Eurographics Symposium on Computer Animation";"SCA";"B";"4607"
"ACM Symposium on Applied Perception";"SAP";"B";"4608"
"ACM Symposium on Solid and Physical Modelling";"SPM";"C";"4607"
"ACM Virtual Reality Software and Technology";"VRST";"B";"4607"
"ACM-SIGRAPH Interactive 3D Graphics and Games";"I3DG";"B";"4607"
"Annual International Workshop on Presence";"ISPR";"C";"4607"
"ArtsIT, Interactivity & Game Creation (was International Conference on Arts and Technology)";"ArtsIT";"C";"4607"
"CHI PLAY: The Annual Symposium on Computer-Human Interaction in Play";"CHI PLAY";"Journal Published";"4608"
"Computer Animation, Information Visualisation, and Digital Effects";"CAivDE";"C";"4607"
"Computer Graphics International";"CGI";"C";"4607"
"Conference for the International Simulation and Gaming Association";"ISAGA";"C";"4607"
"Conference on Games (was Computational Intelligence and Games CIG)";"COG";"C";"4607"
"Digital Games Research Conference";"DIGRA";"C";"4607"
"Euro XR International Conference (was Euro VR)";"Euro XR";"C";"4607"
"Eurographics Symposium on Parallel Graphics and Visualization";"EGPGV";"C";"4607"
"Eurographics/IEEE Symposium on Visualization";"EuroVis";"B";"4607"
"Eye Tracking Research and Applications";"ETRA";"B";"4608"
"Geometry Modeling and Processing";"GMP";"C";"4613"
"Graphics Interface";"GI";"B";"4607"
"IEEE Conference on Virtual Reality and 3D User Interfaces";"VR";"A*";"4607"
"IEEE/ACM International Symposium on Mixed and Augmented Reality";"ISMAR";"A*";"4607"
"Interactive Entertainment";"IE";"Australasian C";"4607"
"International Conference on Artificial Intelligence in Music, Sound, Art and Design";"EvoMUSART";"C";"4602"
"International Conference on Artificial Reality and Telexistance & Eurographics Symposium on Virtual Environments";"EGVE";"C";"4607"
"International Conference on Computer Vision and Graphics";"ICCVG";"National: Poland";"4603"
"International Conference on Cyberworlds (was International Symposium on Cyberworlds)";"CW";"C";"4607"
"International Conference on Entertainment Computing";"ICEC";"C";"4607"
"International Conference on Image and Graphics";"ICIG";"National: China";"4607"
"International Conference on Information Visualisation";"IV";"C";"4608"
"International Conference on Interactive Digital Storytelling (2008 merger of 'ICVS International Conference on Virtual Storytelling' and 'TIDSE Technology for Interactive Digital Storytelling')";"ICIDS";"C";"4607"
"International Conference on Quality of Multimedia Experience";"QoMEX";"B";"4608"
"International Conference on the Foundations of Digital Games";"FDG";"C";"4607"
"International Conferences in Central Europe on Computer Graphics, Visualization and Computer Vision";"WSCG";"National: Czecholslovakia";"4607"
"International Symposium on Ubiquitous Virtual Reality";"ISUVR";"National: S. Korea";"4607"
"International Symposium on Visual Computing";"ISVC";"National: USA";"4607"
"Multimedia and Network Information Systems";"MISSI";"National: Poland";"4603"
"New Zealand Game Developers Conference";"NZGDC";"Australasian C";"4607"
"Pacific Conference on Computer Graphics and Applications";"PG";"Journal Published";"4607"
"SIGGRAPH Asia";"SiggraphA";"A*";"4607"
"Symposium on Geometry Processing";"SGP";"B";"4607"
"AAAI Conference on Human Computation and Crowdsourcing";"HCOMP";"B";"4608"
"AAAI/ACM Conference on AI, Ethics, and Society";"AIES";"C";"4608"
"ACM Conference on Computer Supported Cooperative Work";"CSCW";"A";"4608"
"ACM Information Technology Education";"SIGITE";"National: USA";"4608"
"ACM International Conference on Advances in Computer Entertainment (merged with DIMEA, Digital Interactive Media in Entertainment and Arts, in 2009)";"ACE";"C";"4607"
"ACM International Conference on Interactive Media Experiences";"IMX";"C";"4608"
"ACM International Conference on Interactive Surfaces and Spaces (was International Workshop on Horizontal Interactive Human-Computer Systems: Tabletop)";"ISS";"Journal Published";"4608"
"ACM International Joint Conference on Pervasive and Ubiquitous Computing (PERVASIVE and UbiComp combined from 2013)";"UbiComp";"journal published";"4608"
"ACM SIG International Conference on Computer Graphics and Interactive Techniques";"SIGGRAPH";"A*";"4607"
"ACM SIGIR Conference on Human Information Interaction And Retrieval";"CHIIR";"B";"4605"
"ACM Special Interest Group on Computer Science Education Conference";"SIGCSE";"A";"4608"
"ACM Special Interest Group on Supporting Group Work (was SIGGRoup)";"Group";"B";"4608"
"ACM Symposium on Applied Perception";"SAP";"B";"4608"
"ACM Symposium on User Interface Software and Technology";"UIST";"A*";"4608"
"ACM-SIGRAPH Interactive 3D Graphics and Games";"I3DG";"B";"4607"
"ACM/IEEE International Conference on Human-Robot Interaction";"HRI";"A*";"4608"
"Advanced Visual Interfaces";"AVI";"B";"4608"
"Annual Conference on Innovation and Technology in Computer Science Education";"ITiCSE";"B";"4608"
"Annual International Workshop on Presence";"ISPR";"C";"4607"
"Applications of Information Visualization";"IV-App";"C";"4608"
"ArtsIT, Interactivity & Game Creation (was International Conference on Arts and Technology)";"ArtsIT";"C";"4607"
"Australasian Computing Education Conference (ACE)";"ACE";"Australasian B";"4608"
"Australian Computer Human Interaction Conference";"OZCHI";"Australasian B";"4608"
"Australian Institute of Computer Ethics Conference";"AICE";"Australasian C";"4608"
"British Computer Society Conference on Human-Computer Interaction";"HCI";"National";"4608"
"CHI PLAY: The Annual Symposium on Computer-Human Interaction in Play";"CHI PLAY";"Journal Published";"4608"
"Conference for the International Simulation and Gaming Association";"ISAGA";"C";"4607"
"Conference on Games (was Computational Intelligence and Games CIG)";"COG";"C";"4607"
"Conference on Software Engineering Education and Training (previously Conference is Software Engineering Education, CSEE, changed in 1997)";"CSEET";"C";"4608"
"Conference on Visualization and Data Analysis";"VDA";"National: USA";"4608"
"Cooperative Design, Visualization, and Engineering";"CDVE";"C";"4608"
"Creativity and Cognition";"C&C";"B";"4608"
"Designing Interactive Systems";"DIS";"A";"4608"
"Digital Games Research Conference";"DIGRA";"C";"4607"
"Engineering Interactive Computing Systems";"EICS";"Journal Published";"4608"
"ETHICOMP Conference";"ETHICOMP";"C";"4608"
"EURO AMERICAN CONFERENCE ON TELEMATICS AND INFORMATION SYSTEMS";"EATIS";"C";"4606"
"Euro XR International Conference (was Euro VR)";"Euro XR";"C";"4607"
"Eurographics/IEEE Symposium on Visualization";"EuroVis";"B";"4607"
"European Conference on Computer Supported Cooperative Work";"ECSCW";"B";"4608"
"European Conference on Technology Enhanced Learning";"EC-TEL";"B";"4601"
"Eye Tracking Research and Applications";"ETRA";"B";"4608"
"Frontiers in Education";"FIE";"C";"4608"
"Graphics Interface";"GI";"B";"4607"
"Human System Interaction";"HSI";"C";"4608"
"Human-Agent Interaction";"HAI";"B";"4608"
"IEEE Conference on Systems, Man and Cybernetics";"SMC";"B";"4608"
"IEEE Conference on Virtual Reality and 3D User Interfaces";"VR";"A*";"4607"
"IEEE Global Engineering Education Conference";"EDUCON";"C";"4601"
"IEEE International Conference on Advanced Learning Technologies";"ICALT";"B";"4601"
"IEEE International Conference on Pervasive Computing and Communications";"PERCOM";"A*";"4608"
"IEEE International Conference on Robot and Human Interactive Communication";"RO-MAN";"B";"4608"
"IEEE International Symposium on Computer-Based Medical Systems";"CBMS";"B";"4601"
"IEEE International Symposium on Wearable Computers";"ISWC";"Journal Published";"4608"
"IEEE International Working Conference on Software Visualisation";"VISSOFT";"B";"4608"
"IEEE Pacific Visualization Symposium (was APVIS)";"PacificVis";"B";"4608"
"IEEE Symposium on Visual Languages and Human-Centric Computing (was VL)";"VL/HCC";"B";"4608"
"IEEE Visualization";"IEEE VIS";"A";"4608"
"IEEE/ACM International Conference on Advances in Social Networks Analysis and Mining";"ASONAM";"B";"4605"
"IEEE/ACM International Symposium on Mixed and Augmented Reality";"ISMAR";"A*";"4607"
"IFIP TC13 Conference on Human-Computer Interaction";"Interact";"B";"4608"
"Indian Conference on Human-Computer Interaction";"IndiaHCI";"National: India";"4608"
"Information Visualisation Theory and Practice";"InfVis";"C";"4608"
"Information Visualization in Biomedical Informatics";"IVBI";"C";"4601"
"Informing Science and Information Technology Education";"InSITE";"C";"4608"
"Intelligent Virtual Agents";"IVA";"B";"4602"
"Interaction Design and Children (ACM)";"IDC";"B";"4608"
"Interactive Entertainment";"IE";"Australasian C";"4607"
"International ACM Conference on Automotive User Interfaces and Interactive Vehicular Applications";"Automotive_UI";"B";"4608"
"International ACM SIGACCESS Conference on Computers and Accessibility";"ASSETS";"A";"4608"
"International Computing Education Research Workshop";"ICER";"A";"4608"
"International Conference in Methodologies and Intelligent Systems for Technology Enhanced Learning";"MIS4TEL";"National: Spain";"4601"
"International Conference of the Immersive Learning Research Network";"iLRN";"C";"4601"
"International Conference on Advances in Computer-Human Interactions";"ACHI";"C";"4608"
"International Conference on Affective Computing and Intelligent";"ACII";"B";"4608"
"International Conference on Artificial Intelligence in Education";"AIED";"A";"4601"
"International Conference on Artificial Intelligence in Music, Sound, Art and Design";"EvoMUSART";"C";"4602"
"International Conference on Artificial Reality and Telexistance & Eurographics Symposium on Virtual Environments";"EGVE";"C";"4607"
"International Conference on Computer Supported Cooperative Work in Design";"CSCWD";"C";"4608"
"International Conference on Computer Supported Education";"CSEDU";"B";"4608"
"International Conference on Computer-Human Interaction Research and Applications";"CHIRA";"C";"4608"
"International Conference on Cooperative and Human Aspects of Software Engineering";"CHASE";"B";"4608"
"International Conference on Cooperative Information Systems";"CoopIS";"B";"4608"
"International Conference on Cyberworlds (was International Symposium on Cyberworlds)";"CW";"C";"4607"
"International Conference on Entertainment Computing";"ICEC";"C";"4607"
"International Conference on Evolutionary Multi-Criterion Optimization";"EMO";"C";"4602"
"International Conference on Human Factors in Computing Systems";"CHI";"A*";"4608"
"International Conference on Human-Computer Interaction with Mobile Devices and Services";"MobileHCI";"B";"4608"
"International Conference on Information Visualisation";"IV";"C";"4608"
"International Conference on Intelligent Tutoring Systems";"ITS";"B";"4601"
"International Conference on Intelligent User Interfaces";"IUI";"A";"4608"
"International Conference on Interactive Digital Storytelling (2008 merger of 'ICVS International Conference on Virtual Storytelling' and 'TIDSE Technology for Interactive Digital Storytelling')";"ICIDS";"C";"4607"
"International Conference on Learning Analytics and Knowledge";"LAK";"A";"4608"
"International Conference on Multimodal Interaction (was International Conference on Multimodal Interfaces)";"ICMI";"B";"4608"
"International Conference on Quality of Multimedia Experience";"QoMEX";"B";"4608"
"International Conference on the Foundations of Digital Games";"FDG";"C";"4607"
"International Conference on Ubiquitous Intelligence and Computing";"UIC";"C";"4606"
"International Conference on User Modelling, Adaptation, and Personalization (was AH and UM)";"UMAP";"A";"4608"
"International Cross-Domain Conference for Machine Learning and Knowledge Extraction";"CD-MAKE";"C";"4602"
"International Joint Conference on Biometrics";"IJCB";"B";"4603"
"International Symposium on Distributed Simulation and Real Time Applications";"DS-RT";"C";"4606"
"International Symposium on Ubiquitous Virtual Reality";"ISUVR";"National: S. Korea";"4607"
"International Visualization in Transportation Symposium";"TRB";"National: USA";"4608"
"International Workshop on Formal Methods for interactive Systems";"FMIS";"C";"4612"
