"Title";"Acronym";"Rank";"PrimaryFoR"
"International Workshop on Visualization for Cyber Security";"VizSec";"C";"4608"
"International Workshops on Enabling Technologies: Infrastructures for Collaborative Enterprises";"WETICE";"C";"4606"
"Knowledge Domain Visualisation";"KDViz";"National: UK";"4608"
"Knowledge Visualization and Visual Thinking";"KV";"C";"4608"
"Mensch & Computer";"MuC";"National: Germany";"4608"
"Mobile and Ubiquitous Multimedia (ACM)";"MUM";"B";"4608"
"New Zealand Game Developers Conference";"NZGDC";"Australasian C";"4607"
"Nordic Conference on Human-Computer Interaction";"NordiCHI";"Regional:Scandinavia";"4608"
"Pacific Rim Knowledge Acquisition Workshop";"PKAW";"C";"4602"
"SIGGRAPH Asia";"SiggraphA";"A*";"4607"
"Symposium On Usable Privacy and Security";"SOUPS";"A";"4608"
"Tangible, Embedded, and Embodied Interaction";"TEI";"B";"4608"
"The ACM SIGCAS/SIGCHI Conference on Computing and Sustainable Societies";"COMPASS";"C";"4608"
"Usable Security and Privacy";"USEC";"National: USA";"4604"
"Visual Analytics";"EuroVA";"C";"4608"
"Visual Information Communication and Interaction";"VINCI";"C";"4608"
"Visualization In Science and Education";"GRC";"National: USA";"4608"
"Workshop on Computer Architecture Education";"WCAE";"National: USA";"4608"
"AAAI/ACM Conference on AI, Ethics, and Society";"AIES";"C";"4608"
"ACM Conference on Learning @ Scale";"L@S";"B";"4601"
"ACM International Conference on Advances in Geographic Information Systems";"SIGSPATIAL";"A";"4601"
"ACM International Conference on Knowledge Discovery and Data Mining";"KDD";"A*";"4605"
"ACM International Conference on Web Search and Data Mining";"WSDM";"A";"4605"
"ACM SIGGRAPH conference on Motion Interaction and Games";"MIG";"C";"4607"
"Advances in Neural Information Processing Systems (was NIPS)";"NeurIPS";"A*";"4611"
"Algorithmic Learning Theory";"ALT";"B";"4611"
"Asian Conference on Machine Learning";"ACML";"C";"4611"
"Australasian Joint Conference on Artificial Intelligence";"AI";"Australasian B";"4602"
"Australian Data Mining Conference";"AusDM";"Australasian C";"4605"
"Conference on Computational Natural Language Learning";"CoNLL";"B";"4602"
"Conference on Learning Theory";"COLT";"A*";"4611"
"Conference on Robot Learning";"CoRL";"Unranked";"4602"
"Data Warehousing and Knowledge Discovery";"DaWaK";"B";"4605"
"Discovery Science";"DS";"B";"4611"
"European Conference on Artificial Intelligence";"ECAI";"A";"4602"
"European Conference on Machine Learning and Principles and Practice of Knowledge Discovery in Database (PKDD and ECML combined from 2008)";"ECML PKDD";"A";"4611"
"European Symposium on Artificial Neural Networks";"ESANN";"B";"4611"
"IberoAmerican Congress on Pattern Recognition";"CIARP";"C";"4603"
"IEEE International Conference on Big Data";"BigData";"B";"4605"
"IEEE International Conference on Cognitive Informatics";"ICCI";"C";"4602"
"IEEE International Conference on Content-Based Multimedia Indexing";"CBMI";"C";"4603"
"IEEE International Conference on Data Mining";"ICDM";"A*";"4605"
"IEEE International Conference on Data Science and Advanced Analytics";"DSAA";"B";"4605"
"IEEE International Conference on Data Science and Engineering";"ICDSE";"National:India";"4605"
"IEEE International Conference on Smart Computing";"SmartComp";"B";"4601"
"IEEE International Joint Conference on Neural Networks";"IJCNN";"B";"4611"
"IEEE International Symposium on Adaptive Dynamic Programming and Reinforcement Learning";"IEEE ADPRL";"C";"4611"
"IEEE International Symposium on Computer-Based Medical Systems";"CBMS";"B";"4601"
"IEEE Symposium on Computational Intelligence and Data Mining";"CIDM";"C";"4605"
"IEEE/ACM International Conference on Advances in Social Networks Analysis and Mining";"ASONAM";"B";"4605"
"IEEE/ACM International Conference on Big Data Computing, Applications and Technologies";"BDCAT";"C";"4611"
"Intelligent Data Analysis";"IDA";"B";"4605"
"International Conference on Advanced Data Mining and Applications";"ADMA";"C";"4605"
"International Conference on Applications of Evolutionary Computation";"EvoApplications";"B";"4602"
"International Conference on Artificial Intelligence";"IC-AI";"National: USA";"4602"
"International Conference on Artificial Intelligence and Statistics";"AISTATS";"A";"4611"
"International Conference on Artificial Intelligence: Methodology, Systems, Applications";"AIMSA";"National: Bulgaria";"4602"
"International Conference on Artificial Neural Networks";"ICANN";"C";"4611"
"International Conference on Data Science, Technology and Applications";"DATA";"C";"4605"
"International Conference on Engineering Applications of Neural Networks";"EANN";"C";"4611"
"International Conference on Industrial and Engineering Applications of Artificial Intelligence and Expert Systems";"IEA/AIE";"C";"4602"
"International Conference on Informatics & Data-Driven Medicine";"IDDM";"C";"4611"
"International Conference on Learning Representations";"ICLR";"A*";"4611"
"International Conference on Machine Learning";"ICML";"A*";"4611"
"International Conference on Machine Learning and Applications";"ICMLA";"C";"4611"
"International Conference on Machine Learning and Cybernetics";"ICMLC";"National: China";"4611"
"International Conference on Methods and Models in Automation and Robotics";"MMAR";"National:Poland";"4611"
"International Conference on Neural Information Processing";"ICONIP";"B";"4611"
"International Conference on Neurosymbolic Learning and Reasoning";"NeSy";"C";"4602"
"International Conference on Practical Applications of Computational Biology & Bioinformatics";"PACBB";"National(Spain)";"4602"
"International Cross-Domain Conference for Machine Learning and Knowledge Extraction";"CD-MAKE";"C";"4602"
"International Joint Conference on Artificial Intelligence";"IJCAI";"A*";"4602"
"International Joint Conference on Computational Intelligence";"IJCCI";"C";"4602"
"International Symposium on Neural Networks";"ISNN";"C";"4611"
"International Work-Conference on Artificial and Natural Neural Networks";"IWANN";"National: Spain";"4611"
"International Workshop on Combinations of Intelligent Methods and Applications";"CIMA";"C";"4602"
"National Conference of the American Association for Artificial Intelligence";"AAAI";"A*";"4602"
"Pacific Rim Knowledge Acquisition Workshop";"PKAW";"C";"4602"
"Parallel Problem Solving from Nature";"PPSN";"A";"4611"
"The ACM SIGCAS/SIGCHI Conference on Computing and Sustainable Societies";"COMPASS";"C";"4608"
"ACIS Conference on Software Engineering Research, Management and Applications";"SERA";"C";"4612"
"ACM Conference on Object Oriented Programming Systems Languages and Applications";"OOPSLA";"A";"4612"
"ACM International Conference on the Foundations of Software Engineering (was ESEC/FSE, changed 2024; duplicate previously listed as ESEC, removed from DB)";"FSE";"A*";"4612"
"ACM International Symposium on Computer Architecture";"ISCA";"A*";"CSE"
"ACM SIGPLAN Workshop on Partial Evaluation and Program Manipulation";"PEPM";"C";"4612"
"ACM-SIGACT Symposium on Principles of Programming Languages";"POPL";"A*";"4612"
"ACM-SIGPLAN Conference on Programming Language Design and Implementation";"PLDI";"A*";"4612"
"ACM/SPEC International Conference on Performance Engineering";"ICPE";"B";"4612"
"Architectural Support for Programming Languages and Operating Systems";"ASPLOS";"A*";"4612"
"Asia-Pacific Software Engineering Conference";"APSEC";"C";"4612"
"ASIAN Symposium on Programming Languages and Systems";"APLAS";"B";"4612"
"Automated Software Engineering Conference";"ASE";"A*";"4612"
"Automation of Software Test";"AST";"C";"4612"
"Certified Programs and Proofs";"CPP";"B";"4613"
"Computer Aided Verification";"CAV";"A*";"4612"
"Computer Sciences and Information Technologies";"CSIT";"National";"4602"
"Conference on Agile Software Development";"XP";"B";"4612"
"CONFERENCE ON COMPUTER SCIENCE AND INTELLIGENCE SYSTEMS";"FedCSIS";"C";"4602"
"Conference on Intelligent Computer Mathematics";"CICM";"C";"4613"
"Design, Automation and Test in Europe Conference";"DATE";"A";"CSE"
"Dynamic Languages Symposium";"DLS";"C";"4612"
"Engineering Interactive Computing Systems";"EICS";"Journal Published";"4608"
"Euromicro Conference on Software Engineering and Advanced Applications";"SEAA";"B";"4612"
"European Conference on Modelling Foundations and Applications";"ECMFA";"B";"4612"
"European Conference on Object-Oriented Programming";"ECOOP";"A";"4612"
"European Conference on Pattern Languages of Programs";"EuroPLop";"National: Germany";"4612"
"European Conference on Software Architecture";"ECSA";"B";"4612"
"European Dependable Computing Conference";"EDCC";"Unranked";"4604"
"European SPI";"EuroSPI";"B";"4612"
"European Symposium on Programming";"ESOP";"A";"4612"
"Exploring Modelling Methods in Systems Analysis and Design";"EMMSAD";"C";"4612"
"Formal Methods in Computer-Aided Design";"FMCAD";"B";"4612"
"Forum on Specification and Design Languages";"FDL";"C";"4612"
"Foundations of Software Science and Computational Structures";"FOSSACS";"B";"4613"
"Fundamental Approaches to Software Engineering";"FASE";"B";"4612"
"Haskell Workshop";"HASKELL";"C";"4612"
"IEEE International Conference on Blockchain and Cryptocurrency";"ICBC";"C";"4606"
"IEEE International Conference on e-Science and Grid Computing";"e-Science";"B";"4606"
"IEEE International Conference on Engineering of Complex Computer Systems";"ICECCS";"B";"4612"
"IEEE International Conference on Global Software Engineering";"ICGSE";"C";"4612"
"IEEE International Conference on Program Comprehension (previously IWPC, changed in 2006)";"ICPC";"A";"4612"
"IEEE International Conference on Software Analysis, Evolution and Reengineering";"SANER";"A";"4612"
"IEEE International Conference on Software Maintenance and Evolution (prior to 2014 was ICSM, IEEE International Conference on Software Maintenance)";"ICSME";"A";"4612"
"IEEE International Requirements Engineering Conference";"RE";"A";"4612"
"IEEE International Scientific Conference on Informatics";"Informatics";"National:Slovakia";"4613"
"IEEE International Symposium on Performance Analysis of Systems and Software";"ISPASS";"B";"4612"
"IEEE International Symposium on Rapid System Prototyping (was IEEE Symposium on Rapid Prototyping)";"RSP";"C";"4612"
"IEEE International Working Conference on Mining Software Repositories";"MSR";"A";"4612"
"IEEE International Working Conference on Software Visualisation";"VISSOFT";"B";"4608"
"IEEE International Working Conference on Source Code Analysis and Manipulation";"SCAM";"C";"4612"
"IEEE Software Engineering Workshop";"SEW";"C";"4612"
"IFAC Conference on System Structure and Control";"SSSC";"C";"4612"
"IFIP International Symposium on Computing Performance, Modelling, Measurement and Evaluation";"PERFORMANCE";"Journal Published";"4612"
"IFIP Joint International Conference on Formal Description Techniques and Protocol Specification, Testing, And Verification";"FORTE";"C";"4612"
"Int. Workshop on Formal Methods for Industrial Critical Systems";"FMICS";"C";"4612"
"Integrated Formal Methods";"IFM";"B";"4612"
"International Conference Abstract State Machines, Alloy, B, TLA, VDM, and Z (Previously International Conference of B and Z Users, ZB, changed in 2008)";"ABZ";"C";"4612"
"International Conference in Business Process Management";"BPM";"A";"4612"
"International Conference on AI Engineering – Software Engineering for AI";"CAIN";"B";"4612"
"International Conference on Control, Decision and Information Technologies";"CoDIT";"C";"4612"
"International Conference on Cooperative and Human Aspects of Software Engineering";"CHASE";"B";"4608"
"International Conference on Evaluation and Assessment in Software Engineering";"EASE";"A";"4612"
"International Conference on Evaluation of Novel Approaches to Software Engineering";"ENASE";"B";"4612"
"International Conference on Formal Engineering Methods";"ICFEM";"C";"4612"
"International Conference on Formal Methods and Models for Co-Design";"MEMOCODE";"C";"4612"
"International Conference on Functional Programming";"ICFP";"A";"4612"
"International Conference on Generative Programming and Component Engineering";"GPCE";"B";"4612"
"International Conference on Intelligent Software Methodologies, Tools, and Techniques (was International Conference on Software Methods and Tools)";"SoMeT";"C";"4612"
"International Conference on Logic Programming";"ICLP";"B";"4613"
"International Conference on Managed Programming Languages and Runtimes (was ManLang and previously Principles and Practice of Programming in Java: PPPJ)";"MPLR";"C";"4612"
"International Conference on Model Driven Engineering Languages and Systems (Previously UML, changed in 2005)";"MODELS";"A";"4612"
"International Conference on Model-Driven Engineering and Software Development";"MODELSWARD";"C";"4606"
"International Conference on Network Softwarization";"NetSoft";"B";"4606"
"International Conference on Principles and Practice of Declarative Programming";"PPDP";"C";"4613"
"International Conference on Real-Time and Network Systems";"RTNS";"National: France";"4606"
"International Conference on Reliable Software Technologies";"Ada-Europe";"Journal Published";"4612"
"International Conference on Runtime Verification (was workshop pre 2010)";"RV";"B";"4612"
"International Conference on Software and Data Technologies";"ICSoft";"C";"4612"
"International Conference on Software and System Processes (was ICSP prior to 2011)";"ICSSP";"B";"4612"
"International Conference on Software Architecture (was previously WICSA)";"ICSA";"A";"4612"
"International Conference on Software Engineering";"ICSE";"A*";"4612"
"International Conference on Software Engineering Advances";"ICSEA";"C";"4612"
"International Conference on Software Engineering and Formal Methods";"SEFM";"B";"4612"
"International Conference on Software Engineering and Knowledge Engineering";"SEKE";"C";"4612"
"International Conference on Software Engineering, Artificial Intelligence, Networking and Parallel/Distributed Computing";"SNPD";"C";"4612"
"International Conference on Software Language Engineering";"SLE";"B";"4612"
"International Conference on Software Quality Management";"SQM";"C";"4612"
"International Conference on Software Reuse";"ICSR";"B";"4612"
"International Conference on Software Testing, Verification and Validation";"ICST";"A";"4612"
"International Conference on Technical Debt";"TechDebt";"B";"4612"
"International Conference on Testing Software and Systems";"ICTSS";"C";"4612"
"International Conference on Tests and Proofs";"TAP";"C";"4612"
"International Conference on the Quality of Information and Communications Technology";"QUATIC";"National/Regional";"4612"
"International Joint Conference on Automated Reasoning";"IJCAR";"A";"4602"
"International Symposium on Automated Technology for Verification and Analysis";"ATVA";"B";"4612"
"International Symposium on Code Generation and Optimization";"CGO";"A";"4612"
"International Symposium on Empirical Software Engineering and Measurement";"ESEM";"A";"4612"
"International Symposium on Formal Methods (was Formal Methods Europe FME)";"FM";"B";"4612"
"International Symposium on Leveraging Applications of Formal Methods, Verification and Validation";"ISoLA";"C";"4612"
"International Symposium on Logic-based Program Synthesis and Transformation";"LOPSTR";"C";"4613"
"International Symposium on Memory Management";"ISMM";"C";"4606"
"International Symposium on New Ideas, New Paradigms, and Reflections on Programming and Software";"Onward";"C";"4612"
"International Symposium on Open Collaboration (was International Symposiums on Wikis)";"OPENSYM";"C";"4612"
"International Symposium on Search Based Software Engineering";"SSBSE";"B";"4612"
"International Symposium on Software Engineering for Adaptive and Self-Managing Systems";"SEAMS";"A";"4612"
"International Symposium on Software Engineering: Theories, Tools, and Applications";"SETTA";"National:China";"4612"
"International Symposium on Software Reliability Engineering";"ISSRE";"A";"4612"
"International Symposium on Software Testing and Analysis";"ISSTA";"A";"4612"
"International Symposium on Theoretical Aspects of Software Engineering";"TASE";"National: China";"4612"
"International Workshop on Enterprise and Organizational Modelling and Simulation";"EOMAS";"C";"4612"
"International Workshop on Formal Methods for interactive Systems";"FMIS";"C";"4612"
"International Workshop on Modelling in Software Engineering";"MISE";"C";"4612"
"International Workshop on Principles of Diagnosis";"DX";"C";"4612"
"International Workshop on Requirements Engineering: Foundation for Software Quality";"REFSQ";"B";"4612"
"Joint Conference of the International Workshop on Software Measurement and the International Conference on Software Process and Product Measurement (IWSM and Mensura combined from 2007)";"IWSM Mensura";"C";"4612"
"Latin American Conference on Informatics";"CLEI";"C";"4602"
"Measurement and Modeling of Computer Systems";"SIGMETRICS";"A*";"4612"
"On-Line Testing and Robust System Design";"IOLTS";"C";"CSE"
"Pacific Rim International Symposium on Dependable Computing";"PRDC";"C";"4612"
"Pattern Languages of Programs";"PLOP";"C";"4612"
"Practical Aspects of Declarative Languages";"PADL";"C";"4612"
"Product Focused Software Process Improvement";"PROFES";"B";"4612"
"Software Process Improvement and Capability Determination";"SPICE";"C";"4612"
"Software Product Lines Conference";"SPLC";"B";"4612"
"Software Quality, Reliability, and Security (was International Conference on Quality Software, QSIC, that merged with SERE 2015)";"QRS";"C";"4612"
"Static Analysis Symposium";"SAS";"B";"4612"
"The International Conference on Verification and Evaluation of Computer and Communication Systems";"VECoS";"C";"4606"
"Tools and Algorithms for Construction and Analysis of Systems";"TACAS";"A";"4612"
"Verification, Model Checking and Abstract Interpretation";"VMCAI";"B";"4612"
"Workshop on Domain Specific Modelling";"DSM";"C";"4612"
"Workshop on Formal Techniques for Java-like Programs";"FTfJP";"C";"4612"
"Workshop on Programming Languages and Operating Systems";"PLOS";"C";"4606"
"ACM Conference on Economics and Computation";"EC";"A*";"4602"
"ACM Symposium on Theory of Computing";"STOC";"A*";"4613"
"ACM/SIAM Symposium on Discrete Algorithms";"SODA";"A*";"4613"
"Advances in Modal Logic";"AiML";"B";"4613"
"Algorithms and Data Structures Symposium (was Workshop on Algorithms and Data Structures)";"WADS";"B";"4613"
"Annual Conference on Computer Science Logic";"CSL";"B";"4613"
"Australasian Conference on Combinatorial Mathematics and Combinatorial Computing";"ACCMCC";"Australasian C";"4613"
"Certified Programs and Proofs";"CPP";"B";"4613"
"Cologne-Twente Workshop on Graphs and Combinatorial Optimization";"CTW";"C";"4613"
"Computability in Europe: Logic and Theory of Algorithms";"CiE";"C";"4613"
"Computer Aided Verification";"CAV";"A*";"4612"
"Computer Algebra in Scientific Computing";"CASC";"B";"4613"
"Conference of the European Society for Fuzzy Logic and Technologies";"EUSFLAT";"C";"4602"
"Conference on Algebra and Coalgebra in Computer Science";"CALCO";"B";"4613"
"Conference on Algorithmic Aspects in Information and Management";"AAIM";"C";"4613"
"Conference on Fun with Algorithms";"FUN";"National: Italy";"4613"
"Conference on Integer Programming and Combinatorial Optimization";"IPCO";"B";"4613"
"Conference on Intelligent Computer Mathematics";"CICM";"C";"4613"
"Conference on Interactive Theorem Proving (previously TPHOLs, changed in 2009)";"ITP";"B";"4613"
"Conference on Theory and Applications of Models of Computation";"TAMC";"C";"4613"
"Developments in Language Theory";"DLT";"C";"4613"
"EuroConference on Combinatorics, Graph Theory and Applications";"EUroComb";"C";"4613"
"European Chapter on Combinatorial Optimization";"ECCO";"C";"4613"
"European Symposium on Algorithms";"ESA";"A";"4613"
"European Workshop on Computational Geometry";"EuroCG";"C";"4613"
"Foundations of Software Science and Computational Structures";"FOSSACS";"B";"4613"
"Foundations of Software Technology and Theoretical Computer Science";"FST&TCS";"National: India";"4613"
"Geometry Modeling and Processing";"GMP";"C";"4613"
"Graph Drawing";"GD";"A";"4613"
"IEEE Conference of the Open Innovations Association FRUCT";"FRUCT";"Regional";"4606"
"IEEE Conference on Computational Complexity";"CCC";"A";"4613"
"IEEE International Scientific Conference on Informatics";"Informatics";"National:Slovakia";"4613"
"IEEE Symposium on Computer Arithmetic";"ARITH";"C";"4613"
"IEEE Symposium on Foundations of Computer Science";"FOCS";"A*";"4613"
"IEEE Symposium on Logic in Computer Science";"LICS";"A*";"4613"
"Inductive Logic Programming";"ILP";"B";"4613"
"Information Theory Workshop";"ITW";"B";"4613"
"Innovations in Theoretical Computer Science";"ITCS";"A";"4613"
"Integrated Formal Methods";"IFM";"B";"4612"
"International Colloquium on Automata Languages and Programming";"ICALP";"A*";"4613"
"International Colloquium on Structural Information and Communication Complexity";"SIROCCO";"B";"4613"
"International Colloquium on Theoretical Aspects of Computing";"ICTAC";"C";"4613"
"International Conference Abstract State Machines, Alloy, B, TLA, VDM, and Z (Previously International Conference of B and Z Users, ZB, changed in 2008)";"ABZ";"C";"4612"
"International Conference and Workshops on Algorithms and Computation";"WALCOM";"B";"4613"
"International Conference Formal Concept Analysis Conference";"ICFCA";"C";"4613"
"International Conference on Algorithms and Complexity (was Italian Conference )";"CIAC";"C";"4613"
"International Conference on Complexity, Future Information Systems and Risk";"COMPLEXIS";"C";"4613"
"International Conference on Computability and Complexity in Analysis";"CCA";"C";"4613"
"International Conference on Computing and Combinatorics";"COCOON";"National:China";"4613"
"International Conference on Concurrency Theory";"CONCUR";"B";"4613"
"International Conference on Formal Methods and Models for Co-Design";"MEMOCODE";"C";"4612"
"International Conference on Formal Ontology in Information Systems";"FOIS";"C";"4602"
"International Conference on Formal Structures for Computation and Deduction";"FSCD";"B";"4613"
"International Conference on Graph Transformations";"ICGT";"B";"4613"
"International Conference on Implementation and Application of Automata";"CIAA";"C";"4613"
"International Conference on Language and Automata Theory and Applications";"LATA";"C";"4613"
"International Conference on Logic Programming";"ICLP";"B";"4613"
"International Conference on Logic Programming and Non-monotonic Reasoning";"LPNMR";"B";"4602"
"International Conference on Mathematical Foundations of Programming Semantics";"MFPS";"B";"4613"
"International Conference on Neurosymbolic Learning and Reasoning";"NeSy";"C";"4602"
"International Conference on Principles and Practice of Declarative Programming";"PPDP";"C";"4613"
"International Conference on Probabilistic, Combinatorial, and Asymptotic Methods in the Analysis of Algorithms (was Conference on Analysis of Algorithms)";"AofA";"C";"4613"
"International Conference on Relational and AlgebraicMethods in Computer Science (was International Conference on Relational Methods in Computer Science RelMiCS)";"RAMiCS";"C";"4613"
"International Conference on Reversible Computation";"RC";"C";"4613"
"International Conference on Sequences and their Applications";"SETA";"C";"4604"
"International Conference on the Principles of Knowledge Representation and Reasoning";"KR";"A*";"4602"
"International Conference on Theorem Proving with Analytic Tableaux and Related Methods";"TABLEAUX";"B";"4613"
"International Conference on Theory and Applications of Satisfiability Testing";"SAT";"A";"4602"
"International Conference on Unconventional Computation and Natural Computation (was International Conference on Unconventional Computation)";"UC";"C";"4613"
"International Congress on Computational and Applied Mathematics";"ICCAM";"C";"4613"
"International CSI Computer Conference";"CSICC";"National: Iran";"4613"
"International Frontiers of Algorithmics Workshop";"FAW";"National: China";"4613"
"International Joint Conference on Automated Reasoning";"IJCAR";"A";"4602"
"International Joint Conference on Rules and Reasoning";"RuleML+RR";"B";"4602"
"International Symposium 'Problems of Redundancy in Information and Control Systems'";"Redundancy";"National Russia";"4604"
"International Symposium on Algorithmic Game Theory";"SAGT";"B";"4613"
"International Symposium on Algorithms and Computation";"ISAAC";"B";"4613"
"International Symposium on Combinatorial Optimisation";"ISCO";"C";"4613"
"International Symposium on Computational Geometry";"SoCG";"A*";"4613"
"International Symposium on Experimental Algorithms";"SEA";"B";"4613"
"International Symposium on Formal Methods (was Formal Methods Europe FME)";"FM";"B";"4612"
"International Symposium on Functional and Logic Programming";"FLOPS";"National: Japan";"4613"
"International Symposium on Fundamentals of Computation Theory";"FCT";"B";"4613"
"International Symposium on Information Theory and Its Applications";"ISITA";"C";"4613"
"International Symposium on Latin American Theoretical Informatics";"LATIN";"B";"4613"
"International Symposium on Logic-based Program Synthesis and Transformation";"LOPSTR";"C";"4613"
"International Symposium on Mathematical Foundations of Computer Science";"MFCS";"B";"4613"
"International Symposium on Parameterized and Exact Computation (was IWPEC pre 2004)";"IPEC";"B";"4613"
"International Symposium on Software Engineering: Theories, Tools, and Applications";"SETTA";"National:China";"4612"
"International Symposium on Symbolic and Algebraic Computation";"ISSAC";"B";"4613"
"International Symposium on Symbolic and Numeric Algorithms for Scientific Computing";"SYNASC";"National: romania";"4613"
"International Symposium on Theoretical Aspects of Computer Science";"STACS";"A";"4613"
"International Workshop on Algebraic and Combinatorial Coding Theory";"ACCT";"National";"4613"
